,Year,Film,Nominees,FilmLink,Won
0,1964 (37th),,,,False
1,1964 (37th),7 Faces of Dr. Lao,William J. Tuttle,/wiki/7_Faces_of_Dr._Lao,False
2,1968 (41st),,,,False
3,1968 (41st),Planet of the Apes,John Chambers,/wiki/Planet_of_the_Apes_(1968_film),False
4,1981 (54th),,,,False
5,1981 (54th),An American Werewolf in London,Rick Baker,/wiki/An_American_Werewolf_in_London,True
6,1981 (54th),Heartbeeps,Stan Winston,/wiki/Heartbeeps,False
7,1982 (55th),,,,False
8,1982 (55th),Quest for Fire,Sarah Monzani and Michèle Burke,/wiki/Quest_for_Fire_(film),True
9,1982 (55th),Gandhi,Tom Smith,/wiki/Gandhi_(film),False
10,1983 (56th),,,,False
11,1983 (56th),No award given,No award given,,False
12,1984 (57th),,,,False
13,1984 (57th),Amadeus,Paul LeBlanc and Dick Smith,/wiki/Amadeus_(film),True
14,1984 (57th),2010,Michael Westmore,/wiki/2010:_The_Year_We_Make_Contact,False
15,1984 (57th),"Greystoke: The Legend of Tarzan, Lord of the Apes",Rick Baker and Paul Engelen,"/wiki/Greystoke:_The_Legend_of_Tarzan,_Lord_of_the_Apes",False
16,1985 (58th),,,,False
17,1985 (58th),Mask,Michael Westmore and Zoltan Elek,/wiki/Mask_(1985_film),True
18,1985 (58th),The Color Purple,Ken Chase,/wiki/The_Color_Purple_(1985_film),False
19,1985 (58th),Remo Williams: The Adventure Begins,Carl Fullerton,/wiki/Remo_Williams:_The_Adventure_Begins,False
20,1986 (59th),,,,False
21,1986 (59th),The Fly,Chris Walas and Stephan Dupuis,/wiki/The_Fly_(1986_film),True
22,1986 (59th),The Clan of the Cave Bear,Michael Westmore and Michèle Burke,/wiki/The_Clan_of_the_Cave_Bear_(film),False
23,1986 (59th),Legend,Rob Bottin and Peter Robb-King,/wiki/Legend_(1985_film),False
24,1987 (60th),,,,False
25,1987 (60th),Harry and the Hendersons,Rick Baker,/wiki/Harry_and_the_Hendersons,True
26,1987 (60th),Happy New Year,Bob Laden,/wiki/Happy_New_Year_(1987_film),False
27,1988 (61st),,,,False
28,1988 (61st),Beetlejuice,"Ve Neill, Steve La Porte, and Robert Short",/wiki/Beetlejuice,True
29,1988 (61st),Coming to America,Rick Baker,/wiki/Coming_to_America,False
30,1988 (61st),Scrooged,Thomas R. Burman and Bari Dreiband-Burman,/wiki/Scrooged,False
31,1989 (62nd),,,,False
32,1989 (62nd),Driving Miss Daisy,"Manlio Rocchetti, Lynn Barber, and Kevin Haney",/wiki/Driving_Miss_Daisy,True
33,1989 (62nd),The Adventures of Baron Munchausen,Maggie Weston and Fabrizio Sforza,/wiki/The_Adventures_of_Baron_Munchausen,False
34,1989 (62nd),Dad,"Dick Smith, Ken Diaz, and Greg Nelson",/wiki/Dad_(1989_film),False
35,1990 (63rd),,,,False
36,1990 (63rd),Dick Tracy,John Caglione Jr. and Doug Drexler,/wiki/Dick_Tracy_(1990_film),True
37,1990 (63rd),Cyrano de Bergerac,Michèle Burke and Jean-Pierre Eychenne,/wiki/Cyrano_de_Bergerac_(1990_film),False
38,1990 (63rd),Edward Scissorhands,Ve Neill and Stan Winston,/wiki/Edward_Scissorhands,False
39,1991 (64th),,,,False
40,1991 (64th),Terminator 2: Judgment Day,Stan Winston and Jeff Dawn,/wiki/Terminator_2:_Judgment_Day,True
41,1991 (64th),Hook,"Christina Smith, Monty Westmore, and Greg Cannom",/wiki/Hook_(film),False
42,1991 (64th),Star Trek VI: The Undiscovered Country,"Michael Mills, Edward French, and Richard Snell",/wiki/Star_Trek_VI:_The_Undiscovered_Country,False
43,1992 (65th),,,,False
44,1992 (65th),Bram Stoker's Dracula,"Greg Cannom, Michèle Burke, and Matthew W. Mungle",/wiki/Bram_Stoker%27s_Dracula_(1992_film),True
45,1992 (65th),Batman Returns,"Ve Neill, Ronnie Specter, and Stan Winston",/wiki/Batman_Returns,False
46,1992 (65th),Hoffa,"Ve Neill, Greg Cannom, and John Blake",/wiki/Hoffa_(film),False
47,1993 (66th),,,,False
48,1993 (66th),Mrs. Doubtfire,"Greg Cannom, Ve Neill, and Yolanda Toussieng",/wiki/Mrs._Doubtfire,True
49,1993 (66th),Philadelphia,Carl Fullerton and Alan D'Angerio,/wiki/Philadelphia_(film),False
50,1993 (66th),Schindler's List,"Christina Smith, Matthew W. Mungle, and Judith A. Cory",/wiki/Schindler%27s_List,False
51,1994 (67th),,,,False
52,1994 (67th),Ed Wood,"Rick Baker, Ve Neill, and Yolanda Toussieng",/wiki/Ed_Wood_(film),True
53,1994 (67th),Forrest Gump,"Daniel C. Striepeke, Hallie D'Amore, and Judith A. Cory",/wiki/Forrest_Gump,False
54,1994 (67th),Mary Shelley's Frankenstein,"Daniel Parker, Paul Engelen, and Carol Hemming",/wiki/Mary_Shelley%27s_Frankenstein_(film),False
55,1995 (68th),,,,False
56,1995 (68th),Braveheart,"Peter Frampton, Paul Pattison, and Lois Burwell",/wiki/Braveheart,True
57,1995 (68th),"My Family, Mi Familia",Ken Diaz and Mark Sanchez,/wiki/My_Family_(film),False
58,1995 (68th),Roommates,"Greg Cannom, Bob Laden, and Colleen Callaghan",/wiki/Roommates_(1995_film),False
59,1996 (69th),,,,False
60,1996 (69th),The Nutty Professor,Rick Baker and David LeRoy Anderson,/wiki/The_Nutty_Professor_(1996_film),True
61,1996 (69th),Ghosts of Mississippi,Matthew W. Mungle and Deborah La Mia Denaver,/wiki/Ghosts_of_Mississippi,False
62,1996 (69th),Star Trek: First Contact,"Michael Westmore, Scott Wheeler, and Jake Garber",/wiki/Star_Trek:_First_Contact,False
63,1997 (70th),,,,False
64,1997 (70th),Men in Black,Rick Baker and David LeRoy Anderson,/wiki/Men_in_Black_(1997_film),True
65,1997 (70th),Mrs Brown,"Lisa Westcott, Veronica Brebner, and Beverley Binda",/wiki/Mrs_Brown,False
66,1997 (70th),Titanic,"Tina Earnshaw, Greg Cannom, and Simon Thompson",/wiki/Titanic_(1997_film),False
67,1998 (71st),,,,False
68,1998 (71st),Elizabeth,Jenny Shircore,/wiki/Elizabeth_(film),True
69,1998 (71st),Saving Private Ryan,"Lois Burwell, Conor O'Sullivan, and Daniel C. Striepeke",/wiki/Saving_Private_Ryan,False
70,1998 (71st),Shakespeare in Love,Lisa Westcott and Veronica Brebner,/wiki/Shakespeare_in_Love,False
71,1999 (72nd),,,,False
72,1999 (72nd),Topsy-Turvy,Christine Blundell and Trefor Proud,/wiki/Topsy-Turvy,True
73,1999 (72nd),Austin Powers: The Spy Who Shagged Me,Michèle Burke and Mike Smithson,/wiki/Austin_Powers:_The_Spy_Who_Shagged_Me,False
74,1999 (72nd),Bicentennial Man,Greg Cannom,/wiki/Bicentennial_Man_(film),False
75,1999 (72nd),Life,Rick Baker,/wiki/Life_(1999_film),False
76,2000 (73rd),,,,False
77,2000 (73rd),How the Grinch Stole Christmas,Rick Baker and Gail Ryan,/wiki/How_the_Grinch_Stole_Christmas_(2000_film),True
78,2000 (73rd),The Cell,Michèle Burke and Edouard F. Henriques,/wiki/The_Cell_(film),False
79,2000 (73rd),Shadow of the Vampire,Ann Buchanan and Amber Sibley,/wiki/Shadow_of_the_Vampire,False
80,2001 (74th),,,,False
81,2001 (74th),The Lord of the Rings: The Fellowship of the Ring,Peter Owen and Richard Taylor,/wiki/The_Lord_of_the_Rings:_The_Fellowship_of_the_Ring,True
82,2001 (74th),A Beautiful Mind,Greg Cannom and Colleen Callaghan,/wiki/A_Beautiful_Mind_(film),False
83,2001 (74th),Moulin Rouge!,Maurizio Silvi and Aldo Signoretti,/wiki/Moulin_Rouge!,False
84,2002 (75th),,,,False
85,2002 (75th),Frida,John E. Jackson and Beatrice De Alba,/wiki/Frida_(2002_film),True
86,2002 (75th),The Time Machine,John M. Elliott Jr. and Barbara Lorenz,/wiki/The_Time_Machine_(2002_film),False
87,2003 (76th),,,,False
88,2003 (76th),The Lord of the Rings: The Return of the King,Richard Taylor and Peter King,/wiki/The_Lord_of_the_Rings:_The_Return_of_the_King,True
89,2003 (76th),Master and Commander: The Far Side of the World,Edouard F. Henriques and Yolanda Toussieng,/wiki/Master_and_Commander:_The_Far_Side_of_the_World,False
90,2003 (76th),Pirates of the Caribbean: The Curse of the Black Pearl,Ve Neill and Martin Samuel,/wiki/Pirates_of_the_Caribbean:_The_Curse_of_the_Black_Pearl,False
91,2004 (77th),,,,False
92,2004 (77th),Lemony Snicket's A Series of Unfortunate Events,Valli O'Reilly and Bill Corso,/wiki/Lemony_Snicket%27s_A_Series_of_Unfortunate_Events,True
93,2004 (77th),The Passion of the Christ,Keith VanderLaan and Christien Tinsley,/wiki/The_Passion_of_the_Christ,False
94,2004 (77th),The Sea Inside,Jo Allen and Manuel García,/wiki/The_Sea_Inside,False
95,2005 (78th),,,,False
96,2005 (78th),"The Chronicles of Narnia: The Lion, the Witch and the Wardrobe",Howard Berger and Tami Lane,"/wiki/The_Chronicles_of_Narnia:_The_Lion,_the_Witch_and_the_Wardrobe",True
97,2005 (78th),Cinderella Man,David LeRoy Anderson and Lance Anderson,/wiki/Cinderella_Man,False
98,2005 (78th),Star Wars: Episode III – Revenge of the Sith,Dave Elsey and Nikki Gooley,/wiki/Star_Wars:_Episode_III_%E2%80%93_Revenge_of_the_Sith,False
99,2006 (79th),,,,False
100,2006 (79th),Pan's Labyrinth,David Martí and Montse Ribé,/wiki/Pan%27s_Labyrinth,True
101,2006 (79th),Apocalypto,Aldo Signoretti and Vittorio Sodano,/wiki/Apocalypto,False
102,2006 (79th),Click,Kazuhiro Tsuji and Bill Corso,/wiki/Click_(2006_film),False
103,2007 (80th),,,,False
104,2007 (80th),La Vie en Rose,Didier Lavergne and Jan Archibald,/wiki/La_Vie_en_rose_(film),True
105,2007 (80th),Norbit,Rick Baker and Kazuhiro Tsuji,/wiki/Norbit,False
106,2007 (80th),Pirates of the Caribbean: At World's End,Ve Neill and Martin Samuel,/wiki/Pirates_of_the_Caribbean:_At_World%27s_End,False
107,2008 (81st),,,,False
108,2008 (81st),The Curious Case of Benjamin Button,Greg Cannom,/wiki/The_Curious_Case_of_Benjamin_Button_(film),True
109,2008 (81st),The Dark Knight,John Caglione Jr. and Conor O'Sullivan,/wiki/The_Dark_Knight,False
110,2008 (81st),Hellboy II: The Golden Army,Mike Elizalde and Thomas Floutz,/wiki/Hellboy_II:_The_Golden_Army,False
111,2009 (82nd),,,,False
112,2009 (82nd),Star Trek,"Barney Burman, Mindy Hall, and Joel Harlow",/wiki/Star_Trek_(film),True
113,2009 (82nd),Il Divo,Aldo Signoretti and Vittorio Sodano,/wiki/Il_divo_(film),False
114,2009 (82nd),The Young Victoria,Jon Henry Gordon and Jenny Shircore,/wiki/The_Young_Victoria,False
115,2010 (83rd),,,,False
116,2010 (83rd),The Wolfman,Rick Baker and Dave Elsey,/wiki/The_Wolfman_(film),True
117,2010 (83rd),Barney's Version,Adrien Morot,/wiki/Barney%27s_Version_(film),False
118,2010 (83rd),The Way Back,"Gregory Funk, Edouard F. Henriques, and Yolanda Toussieng",/wiki/The_Way_Back_(2010_film),False
119,2011 (84th),,,,False
120,2011 (84th),The Iron Lady,Mark Coulier and J. Roy Helland,/wiki/The_Iron_Lady_(film),True
121,2011 (84th),Albert Nobbs,"Martial Corneville, Lynn Johnson, and Matthew W. Mungle",/wiki/Albert_Nobbs,False
122,2011 (84th),Harry Potter and the Deathly Hallows – Part 2,"Nick Dudman, Amanda Knight, and Lisa Tomblin",/wiki/Harry_Potter_and_the_Deathly_Hallows_%E2%80%93_Part_2,False
123,2012 (85th),,,,False
124,2012 (85th),Les Misérables,Lisa Westcott and Julie Dartnell,/wiki/Les_Mis%C3%A9rables_(2012_film),True
125,2012 (85th),Hitchcock,"Howard Berger, Peter Montagna, and Martin Samuel",/wiki/Hitchcock_(film),False
126,2012 (85th),The Hobbit: An Unexpected Journey,"Peter Swords King, Rick Findlater, and Tami Lane",/wiki/The_Hobbit:_An_Unexpected_Journey,False
127,2013 (86th),,,,False
128,2013 (86th),Dallas Buyers Club,Adruitha Lee and Robin Mathews,/wiki/Dallas_Buyers_Club,True
129,2013 (86th),Jackass Presents: Bad Grandpa,Stephen Prouty,/wiki/Jackass_Presents:_Bad_Grandpa,False
130,2013 (86th),The Lone Ranger,Joel Harlow and Gloria Pasqua-Casny,/wiki/The_Lone_Ranger_(2013_film),False
131,2014 (87th),,,,False
132,2014 (87th),The Grand Budapest Hotel,Frances Hannon and Mark Coulier,/wiki/The_Grand_Budapest_Hotel,True
133,2014 (87th),Foxcatcher,Bill Corso and Dennis Liddiard,/wiki/Foxcatcher,False
134,2014 (87th),Guardians of the Galaxy,Elizabeth Yianni-Georgiou and David White,/wiki/Guardians_of_the_Galaxy_(film),False
135,2015 (88th) [7],,,,False
136,2015 (88th) [7],Mad Max: Fury Road,"Lesley Vanderwalt, Elka Wardega and Damian Martin",/wiki/Mad_Max:_Fury_Road,True
137,2015 (88th) [7],The 100-Year-Old Man Who Climbed Out of the Window and Disappeared,Love Larson and Eva von Bahr,/wiki/The_Hundred-Year-Old_Man_Who_Climbed_Out_of_the_Window_and_Disappeared_(film),False
138,2015 (88th) [7],The Revenant,"Siân Grigg, Duncan Jarman, and Robert Pandini",/wiki/The_Revenant_(2015_film),False
139,2016 (89th) [8],,,,False
140,2016 (89th) [8],Suicide Squad,"Alessandro Bertolazzi, Giorgio Gregorini, and Christopher Nelson",/wiki/Suicide_Squad_(2016_film),True
141,2016 (89th) [8],A Man Called Ove,Love Larson and Eva von Bahr,/wiki/A_Man_Called_Ove_(film),False
142,2016 (89th) [8],Star Trek Beyond,Joel Harlow and Richard Alonzo,/wiki/Star_Trek_Beyond,False
143,2017 (90th) [9],,,,False
144,2017 (90th) [9],Darkest Hour,"Kazuhiro Tsuji, David Malinowski, and Lucy Sibbick",/wiki/Darkest_Hour_(film),True
145,2017 (90th) [9],Victoria & Abdul,Daniel Phillips and Lou Sheppard,/wiki/Victoria_%26_Abdul,False
146,2017 (90th) [9],Wonder,Arjen Tuiten,/wiki/Wonder_(film),False
147,2018 (91st) [10],,,,False
148,2018 (91st) [10],Vice,"Greg Cannom, Kate Biscoe, and Patricia Dehaney",/wiki/Vice_(2018_film),True
149,2018 (91st) [10],Border,Göran Lundström and Pamela Goldammer,/wiki/Border_(2018_Swedish_film),False
150,2018 (91st) [10],Mary Queen of Scots,"Jenny Shircore, Marc Pilcher, and Jessica Brooks",/wiki/Mary_Queen_of_Scots_(2018_film),False
151,2019 (92nd) [10],,,,False
152,2019 (92nd) [10],Bombshell,"Kazu Hiro, Anne Morgan, and Vivian Baker",/wiki/Bombshell_(2019_film),True
153,2019 (92nd) [10],Joker,Nicki Ledermann and Kay Georgiou,/wiki/Joker_(2019_film),False
154,2019 (92nd) [10],Judy,Jeremy Woodhead,/wiki/Judy_(film),False
155,2019 (92nd) [10],Maleficent: Mistress of Evil,"Paul Gooch, Arjen Tuiten, and David White",/wiki/Maleficent:_Mistress_of_Evil,False
156,2019 (92nd) [10],1917,"Naomi Donne, Tristan Versluis, and Rebecca Cole",/wiki/1917_(2019_film),False
157,2020/21 (93rd) [11],,,,False
158,2020/21 (93rd) [11],Ma Rainey's Black Bottom,"Sergio López-Rivera, Mia Neal, and Jamika Wilson",/wiki/Ma_Rainey%27s_Black_Bottom_(film),True
159,2020/21 (93rd) [11],Emma,"Marese Langan, Laura Allen, and Claudia Stolze",/wiki/Emma_(2020_film),False
160,2020/21 (93rd) [11],Hillbilly Elegy,"Eryn Krueger Mekash, Patricia Dehaney, and Matthew Mungle",/wiki/Hillbilly_Elegy_(film),False
161,2020/21 (93rd) [11],Mank,"Gigi Williams, Kimberley Spiteri, and Colleen LaBaff",/wiki/Mank,False
162,2020/21 (93rd) [11],Pinocchio,"Dalia Colli, Mark Coulier, and Francesco Pegoretti",/wiki/Pinocchio_(2019_film),False
163,2021 (94th) [12],,,,False
164,2021 (94th) [12],The Eyes of Tammy Faye,"Linda Dowds, Stephanie Ingram, and Justin Raleigh",/wiki/The_Eyes_of_Tammy_Faye_(2021_film),True
165,2021 (94th) [12],Coming 2 America,"Mike Marino, Stacey Morris, and Carla Farmer",/wiki/Coming_2_America,False
166,2021 (94th) [12],Cruella,"Nadia Stacey, Naomi Donne, and Julia Vernon",/wiki/Cruella_(film),False
167,2021 (94th) [12],Dune,"Donald Mowat, Love Larson, and Eva von Bahr",/wiki/Dune_(2021_film),False
168,2021 (94th) [12],House of Gucci,"Göran Lundström, Anna Carin Lock, and Frederic Aspiras",/wiki/House_of_Gucci,False
169,2022 (95th) [13],,,,False
170,2022 (95th) [13],The Whale,"Adrien Morot, Judy Chin and Annemarie Bradley",/wiki/The_Whale_(2022_film),True
171,2022 (95th) [13],All Quiet on the Western Front,Heike Merker and Linda Eisenhamerová,/wiki/All_Quiet_on_the_Western_Front_(2022_film),False
172,2022 (95th) [13],The Batman,"Naomi Donne, Mike Marino and Mike Fontaine",/wiki/The_Batman_(film),False
173,2022 (95th) [13],Black Panther: Wakanda Forever,Camille Friend and Joel Harlow,/wiki/Black_Panther:_Wakanda_Forever,False
174,2022 (95th) [13],Elvis,"Mark Coulier, Jason Baird and Aldo Signoretti",/wiki/Elvis_(2022_film),False
175,2023 (96th) [14],,,,False
176,2023 (96th) [14],Golda,"Karen Hartley Thomas, Suzi Battersby and Ashra Kelly-Blue",/wiki/Golda_(film),False
177,2023 (96th) [14],Maestro,"Kazu Hiro, Kay Georgiou and Lori McCoy-Bell",/wiki/Maestro_(2023_film),False
178,2023 (96th) [14],Oppenheimer,Luisa Abel,/wiki/Oppenheimer_(film),False
179,2023 (96th) [14],Poor Things,"Nadia Stacey, Mark Coulier and Josh Weston",/wiki/Poor_Things_(film),False
180,2023 (96th) [14],Society of the Snow,"Ana López-Puigcerver, David Martí and Montse Ribé",/wiki/Society_of_the_Snow,False
